{
  "evaluationVersion": "0.1.0-draft",
  "contractArtifactVersion": "2.0.0-draft.1",
  "humanApproved": false,
  "executionStatus": "NOT_RUN_NO_ENGINE",
  "cases": [
    {
      "id": "R1-001",
      "category": "hard_constraints",
      "name": "Đủ điều kiện cơ bản",
      "approval": {
        "status": "PENDING",
        "approvedBy": null,
        "approvedAt": null
      },
      "fixtureManifest": "backend/src/test/resources/contracts/t12/r1/v2.0.0-draft.1/manifest.json",
      "turns": [
        {
          "operation": "SEARCH",
          "request": {
            "contractVersion": "2.0",
            "criteria": {
              "locationKeyword": "Synthetic City",
              "checkInDate": "2026-11-20",
              "checkOutDate": "2026-11-22",
              "adults": 2,
              "children": 0,
              "extraBeds": 0,
              "roomsCount": 1,
              "requiredFeatureCodes": [],
              "preferredFeatureCodes": []
            }
          }
        }
      ],
      "fixtureMutations": [],
      "expected": {
        "businessWriteCalls": 0,
        "status": "RESULTS",
        "expectedTopIds": [
          1026,
          1001,
          1002,
          1003,
          1004
        ],
        "eligibleIds": [
          1001,
          1002,
          1003,
          1004,
          1005,
          1006,
          1007,
          1008,
          1009,
          1010,
          1011,
          1012,
          1013,
          1014,
          1015,
          1016,
          1017,
          1018,
          1019,
          1020,
          1021,
          1022,
          1023,
          1024,
          1025,
          1026
        ]
      },
      "context": {
        "clock": "2026-10-08T10:00:00+07:00",
        "ownerId": "synthetic-owner-a",
        "allowedHotelIds": [
          1,
          2,
          3,
          4,
          5,
          6
        ],
        "sessionFixtureVersion": 1,
        "llmState": "AVAILABLE",
        "ragState": "DISABLED",
        "rateLimitExceeded": false,
        "runtimeCandidateBudget": null
      }
    },
    {
      "id": "R1-002",
      "category": "hard_constraints",
      "name": "Vượt sức chứa người lớn",
      "approval": {
        "status": "PENDING",
        "approvedBy": null,
        "approvedAt": null
      },
      "fixtureManifest": "backend/src/test/resources/contracts/t12/r1/v2.0.0-draft.1/manifest.json",
      "turns": [
        {
          "operation": "SEARCH",
          "request": {
            "contractVersion": "2.0",
            "criteria": {
              "locationKeyword": "Synthetic City",
              "checkInDate": "2026-11-20",
              "checkOutDate": "2026-11-22",
              "adults": 3,
              "children": 0,
              "extraBeds": 0,
              "roomsCount": 1,
              "requiredFeatureCodes": [],
              "preferredFeatureCodes": []
            }
          }
        }
      ],
      "fixtureMutations": [],
      "expected": {
        "businessWriteCalls": 0,
        "status": "NO_MATCH"
      },
      "context": {
        "clock": "2026-10-08T10:00:00+07:00",
        "ownerId": "synthetic-owner-a",
        "allowedHotelIds": [
          1,
          2,
          3,
          4,
          5,
          6
        ],
        "sessionFixtureVersion": 1,
        "llmState": "AVAILABLE",
        "ragState": "DISABLED",
        "rateLimitExceeded": false,
        "runtimeCandidateBudget": null
      }
    },
    {
      "id": "R1-003",
      "category": "hard_constraints",
      "name": "Vượt sức chứa trẻ em",
      "approval": {
        "status": "PENDING",
        "approvedBy": null,
        "approvedAt": null
      },
      "fixtureManifest": "backend/src/test/resources/contracts/t12/r1/v2.0.0-draft.1/manifest.json",
      "turns": [
        {
          "operation": "SEARCH",
          "request": {
            "contractVersion": "2.0",
            "criteria": {
              "locationKeyword": "Synthetic City",
              "checkInDate": "2026-11-20",
              "checkOutDate": "2026-11-22",
              "adults": 2,
              "children": 2,
              "extraBeds": 0,
              "roomsCount": 1,
              "requiredFeatureCodes": [],
              "preferredFeatureCodes": []
            }
          }
        }
      ],
      "fixtureMutations": [],
      "expected": {
        "businessWriteCalls": 0,
        "status": "NO_MATCH"
      },
      "context": {
        "clock": "2026-10-08T10:00:00+07:00",
        "ownerId": "synthetic-owner-a",
        "allowedHotelIds": [
          1,
          2,
          3,
          4,
          5,
          6
        ],
        "sessionFixtureVersion": 1,
        "llmState": "AVAILABLE",
        "ragState": "DISABLED",
        "rateLimitExceeded": false,
        "runtimeCandidateBudget": null
      }
    },
    {
      "id": "R1-004",
      "category": "hard_constraints",
      "name": "Vượt tổng khách",
      "approval": {
        "status": "PENDING",
        "approvedBy": null,
        "approvedAt": null
      },
      "fixtureManifest": "backend/src/test/resources/contracts/t12/r1/v2.0.0-draft.1/manifest.json",
      "turns": [
        {
          "operation": "SEARCH",
          "request": {
            "contractVersion": "2.0",
            "criteria": {
              "locationKeyword": "Synthetic City",
              "checkInDate": "2026-11-20",
              "checkOutDate": "2026-11-22",
              "adults": 2,
              "children": 2,
              "extraBeds": 0,
              "roomsCount": 1,
              "requiredFeatureCodes": [],
              "preferredFeatureCodes": []
            }
          }
        }
      ],
      "fixtureMutations": [],
      "expected": {
        "businessWriteCalls": 0,
        "status": "NO_MATCH"
      },
      "context": {
        "clock": "2026-10-08T10:00:00+07:00",
        "ownerId": "synthetic-owner-a",
        "allowedHotelIds": [
          1,
          2,
          3,
          4,
          5,
          6
        ],
        "sessionFixtureVersion": 1,
        "llmState": "AVAILABLE",
        "ragState": "DISABLED",
        "rateLimitExceeded": false,
        "runtimeCandidateBudget": null
      }
    },
    {
      "id": "R1-005",
      "category": "hard_constraints",
      "name": "Vượt giường phụ",
      "approval": {
        "status": "PENDING",
        "approvedBy": null,
        "approvedAt": null
      },
      "fixtureManifest": "backend/src/test/resources/contracts/t12/r1/v2.0.0-draft.1/manifest.json",
      "turns": [
        {
          "operation": "SEARCH",
          "request": {
            "contractVersion": "2.0",
            "criteria": {
              "locationKeyword": "Synthetic City",
              "checkInDate": "2026-11-20",
              "checkOutDate": "2026-11-22",
              "adults": 2,
              "children": 0,
              "extraBeds": 2,
              "roomsCount": 1,
              "requiredFeatureCodes": [],
              "preferredFeatureCodes": []
            }
          }
        }
      ],
      "fixtureMutations": [],
      "expected": {
        "businessWriteCalls": 0,
        "status": "NO_MATCH"
      },
      "context": {
        "clock": "2026-10-08T10:00:00+07:00",
        "ownerId": "synthetic-owner-a",
        "allowedHotelIds": [
          1,
          2,
          3,
          4,
          5,
          6
        ],
        "sessionFixtureVersion": 1,
        "llmState": "AVAILABLE",
        "ragState": "DISABLED",
        "rateLimitExceeded": false,
        "runtimeCandidateBudget": null
      }
    },
    {
      "id": "R1-006",
      "category": "hard_constraints",
      "name": "Thiếu tiện ích bắt buộc",
      "approval": {
        "status": "PENDING",
        "approvedBy": null,
        "approvedAt": null
      },
      "fixtureManifest": "backend/src/test/resources/contracts/t12/r1/v2.0.0-draft.1/manifest.json",
      "turns": [
        {
          "operation": "SEARCH",
          "request": {
            "contractVersion": "2.0",
            "criteria": {
              "locationKeyword": "Synthetic City",
              "checkInDate": "2026-11-20",
              "checkOutDate": "2026-11-22",
              "adults": 2,
              "children": 0,
              "extraBeds": 0,
              "roomsCount": 1,
              "requiredFeatureCodes": [
                "BALCONY"
              ],
              "preferredFeatureCodes": []
            }
          }
        }
      ],
      "fixtureMutations": [],
      "expected": {
        "businessWriteCalls": 0,
        "status": "NO_MATCH"
      },
      "context": {
        "clock": "2026-10-08T10:00:00+07:00",
        "ownerId": "synthetic-owner-a",
        "allowedHotelIds": [
          1,
          2,
          3,
          4,
          5,
          6
        ],
        "sessionFixtureVersion": 1,
        "llmState": "AVAILABLE",
        "ragState": "DISABLED",
        "rateLimitExceeded": false,
        "runtimeCandidateBudget": null
      }
    },
    {
      "id": "R1-007",
      "category": "hard_constraints",
      "name": "Tiện ích ưa thích không phải điều kiện cứng",
      "approval": {
        "status": "PENDING",
        "approvedBy": null,
        "approvedAt": null
      },
      "fixtureManifest": "backend/src/test/resources/contracts/t12/r1/v2.0.0-draft.1/manifest.json",
      "turns": [
        {
          "operation": "SEARCH",
          "request": {
            "contractVersion": "2.0",
            "criteria": {
              "locationKeyword": "Synthetic City",
              "checkInDate": "2026-11-20",
              "checkOutDate": "2026-11-22",
              "adults": 2,
              "children": 0,
              "extraBeds": 0,
              "roomsCount": 1,
              "requiredFeatureCodes": [],
              "preferredFeatureCodes": [
                "BALCONY"
              ]
            }
          }
        }
      ],